<?xml version="1.0" encoding="UTF-8"?>
<!DOCTYPE appia PUBLIC "-//DTDName//DTD//EN"
	"../xml/appiaxml.dtd">
<appia>
	<template name="Perf Udp+Fifo Template">
	<session name="udp" sharing="private">
		<protocol>net.sf.appia.protocols.udpsimple.UdpSimpleLayer</protocol>
	</session>
	<session name="fifo" sharing="private">
		<protocol>net.sf.appia.protocols.fifo.FifoLayer</protocol>
	</session>
	<session name="frag" sharing="private">
		<protocol>net.sf.appia.protocols.frag.FragLayer</protocol>
	</session>
	<session name="gbl" sharing="private">
		<protocol>net.sf.appia.protocols.group.bottom.GroupBottomLayer</protocol>
	</session>
	<session name="gol" sharing="private">
		<protocol>net.sf.appia.protocols.group.heal.GossipOutLayer</protocol>
	</session>
	<session name="suspectl" sharing="private">
		<protocol>net.sf.appia.protocols.group.suspect.SuspectLayer</protocol>
	</session>		
	<session name="intral" sharing="private">
		<protocol>net.sf.appia.protocols.group.intra.IntraLayer</protocol>
	</session>
	<session name="interl" sharing="private">
		<protocol>net.sf.appia.protocols.group.inter.InterLayer</protocol>
	</session>
	<session name="hl" sharing="private">
		<protocol>net.sf.appia.protocols.group.heal.HealLayer</protocol>
	</session>
	<session name="stablel" sharing="private">
		<protocol>net.sf.appia.protocols.group.stable.StableLayer</protocol>
	</session>
	<session name="ll" sharing="private">
		<protocol>net.sf.appia.protocols.group.leave.LeaveLayer</protocol>
	</session>
	<session name="vsl" sharing="private">
		<protocol>net.sf.appia.protocols.group.sync.VSyncLayer</protocol>
	</session>
	<session name="perf" sharing="private">
		<protocol>net.sf.appia.test.perf.PerfLayer</protocol>
	</session>
	</template>

	<template name="Perf Udp+NakFifo Template">
	<session name="udp" sharing="private">
		<protocol>net.sf.appia.protocols.udpsimple.UdpSimpleLayer</protocol>
	</session>
	<session name="nakfifo" sharing="private">
		<protocol>net.sf.appia.protocols.nakfifo.NakFifoLayer</protocol>
	</session>
	<session name="frag" sharing="private">
		<protocol>net.sf.appia.protocols.frag.FragLayer</protocol>
	</session>
	<session name="gbl" sharing="private">
		<protocol>net.sf.appia.protocols.group.bottom.GroupBottomLayer</protocol>
	</session>
	<session name="gol" sharing="private">
		<protocol>net.sf.appia.protocols.group.heal.GossipOutLayer</protocol>
	</session>
	<session name="suspectl" sharing="private">
		<protocol>net.sf.appia.protocols.group.suspect.SuspectLayer</protocol>
	</session>		
	<session name="intral" sharing="private">
		<protocol>net.sf.appia.protocols.group.intra.IntraLayer</protocol>
	</session>
	<session name="interl" sharing="private">
		<protocol>net.sf.appia.protocols.group.inter.InterLayer</protocol>
	</session>
	<session name="hl" sharing="private">
		<protocol>net.sf.appia.protocols.group.heal.HealLayer</protocol>
	</session>
	<session name="stablel" sharing="private">
		<protocol>net.sf.appia.protocols.group.stable.StableLayer</protocol>
	</session>
	<session name="ll" sharing="private">
		<protocol>net.sf.appia.protocols.group.leave.LeaveLayer</protocol>
	</session>
	<session name="vsl" sharing="private">
		<protocol>net.sf.appia.protocols.group.sync.VSyncLayer</protocol>
	</session>
	<session name="perf" sharing="private">
		<protocol>net.sf.appia.test.perf.PerfLayer</protocol>
	</session>
	</template>

	<template name="Perf Tcp Template">
	<session name="tcp" sharing="private">
		<protocol>net.sf.appia.protocols.tcpcomplete.TcpCompleteLayer</protocol>
	</session>
	<session name="gbl" sharing="private">
		<protocol>net.sf.appia.protocols.group.bottom.GroupBottomLayer</protocol>
	</session>
	<session name="gol" sharing="private">
		<protocol>net.sf.appia.protocols.group.heal.GossipOutLayer</protocol>
	</session>
	<session name="suspectl" sharing="private">
		<protocol>net.sf.appia.protocols.group.suspect.SuspectLayer</protocol>
	</session>		
	<session name="intral" sharing="private">
		<protocol>net.sf.appia.protocols.group.intra.IntraLayer</protocol>
	</session>
	<session name="interl" sharing="private">
		<protocol>net.sf.appia.protocols.group.inter.InterLayer</protocol>
	</session>
	<session name="hl" sharing="private">
		<protocol>net.sf.appia.protocols.group.heal.HealLayer</protocol>
	</session>
	<session name="stablel" sharing="private">
		<protocol>net.sf.appia.protocols.group.stable.StableLayer</protocol>
	</session>
	<session name="ll" sharing="private">
		<protocol>net.sf.appia.protocols.group.leave.LeaveLayer</protocol>
	</session>
	<session name="vsl" sharing="private">
		<protocol>net.sf.appia.protocols.group.sync.VSyncLayer</protocol>
	</session>
	<session name="perf" sharing="private">
		<protocol>net.sf.appia.test.perf.PerfLayer</protocol>
	</session>
	</template>

	<template name="Perf Udp+NakFifoMulticast Template">
	<session name="udp" sharing="private">
		<protocol>net.sf.appia.protocols.udpsimple.UdpSimpleLayer</protocol>
	</session>
	<session name="nakfifo" sharing="private">
		<protocol>net.sf.appia.protocols.nakfifo.multicast.NakFifoMulticastLayer</protocol>
	</session>
	<session name="frag" sharing="private">
		<protocol>net.sf.appia.protocols.frag.FragLayer</protocol>
	</session>
	<session name="gbl" sharing="private">
		<protocol>net.sf.appia.protocols.group.bottom.GroupBottomLayer</protocol>
	</session>
	<session name="gol" sharing="private">
		<protocol>net.sf.appia.protocols.group.heal.GossipOutLayer</protocol>
	</session>
	<session name="suspectl" sharing="private">
		<protocol>net.sf.appia.protocols.group.suspect.SuspectLayer</protocol>
	</session>		
	<session name="intral" sharing="private">
		<protocol>net.sf.appia.protocols.group.intra.IntraLayer</protocol>
	</session>
	<session name="interl" sharing="private">
		<protocol>net.sf.appia.protocols.group.inter.InterLayer</protocol>
	</session>
	<session name="hl" sharing="private">
		<protocol>net.sf.appia.protocols.group.heal.HealLayer</protocol>
	</session>
	<session name="stablel" sharing="private">
		<protocol>net.sf.appia.protocols.group.stable.StableLayer</protocol>
	</session>
	<session name="ll" sharing="private">
		<protocol>net.sf.appia.protocols.group.leave.LeaveLayer</protocol>
	</session>
	<session name="vsl" sharing="private">
		<protocol>net.sf.appia.protocols.group.sync.VSyncLayer</protocol>
	</session>
	<session name="perf" sharing="private">
		<protocol>net.sf.appia.test.perf.PerfLayer</protocol>
	</session>
	</template>

	<template name="Perf Tcp token Template">
	<session name="tcp" sharing="private">
		<protocol>net.sf.appia.protocols.tcpcomplete.TcpCompleteLayer</protocol>
	</session>
	<session name="gbl" sharing="private">
		<protocol>net.sf.appia.protocols.group.bottom.GroupBottomLayer</protocol>
	</session>
	<session name="gol" sharing="private">
		<protocol>net.sf.appia.protocols.group.heal.GossipOutLayer</protocol>
	</session>
	<session name="suspectl" sharing="private">
		<protocol>net.sf.appia.protocols.group.suspect.SuspectLayer</protocol>
	</session>		
	<session name="intral" sharing="private">
		<protocol>net.sf.appia.protocols.group.intra.IntraLayer</protocol>
	</session>
	<session name="interl" sharing="private">
		<protocol>net.sf.appia.protocols.group.inter.InterLayer</protocol>
	</session>
	<session name="hl" sharing="private">
		<protocol>net.sf.appia.protocols.group.heal.HealLayer</protocol>
	</session>
	<session name="stablel" sharing="private">
		<protocol>net.sf.appia.protocols.group.stable.StableLayer</protocol>
	</session>
	<session name="ll" sharing="private">
		<protocol>net.sf.appia.protocols.group.leave.LeaveLayer</protocol>
	</session>
	<session name="vsl" sharing="private">
		<protocol>net.sf.appia.protocols.group.sync.VSyncLayer</protocol>
	</session>
    <session name="total" sharing="private">
		 <protocol>net.sf.appia.protocols.total.token.TotalTokenLayer</protocol>
    </session>	
	<session name="perf" sharing="private">
		<protocol>net.sf.appia.test.perf.PerfLayer</protocol>
	</session>
	</template>

	<management />


	<channel name="Perf Channel" template="Perf Udp+NakFifoMulticast Template" initialized="no">
		<chsession name="perf">
			<!-- Example for ring test with two members and IP-Multicast address for gossip dissemination. -->
			<parameter name="n">3</parameter>
			<parameter name="k">10</parameter>
			<parameter name="r">10</parameter>
			<parameter name="m">10</parameter>
			<parameter name="gossip">224.0.0.3:10001</parameter>
		</chsession>
	</channel>


	<channel name="Perf Channel" template="Perf Tcp Template" initialized="yes" managed="yes">
		<chsession name="perf">
			<parameter name="lo">false</parameter>
			<parameter name="n">2</parameter>
			<parameter name="k">10</parameter>
			<parameter name="r">10000</parameter>
			<parameter name="m">1000</parameter>
			<parameter name="gossip">224.0.0.3:10001</parameter>
		</chsession>
    <chsession name="total">
		<parameter name="num_messages_per_token">10</parameter>
	</chsession>
	</channel>

	<channel name="Perf Channel" template="Perf Udp+Fifo Template" initialized="no">
		<chsession name="perf">
			<parameter name="lo">true</parameter>
			<parameter name="n">4</parameter>
			<parameter name="k">1</parameter>
			<parameter name="r">10</parameter>
			<parameter name="m">1</parameter>
			<parameter name="gossip">224.0.0.3:10001</parameter>
		</chsession>
	</channel>

</appia>
