<?xml version="1.0" encoding="UTF-8"?>
<!DOCTYPE appia PUBLIC "-//DTDName//DTD//EN"
         "appiaxml.dtd">
 

<appia>

<template name="tcp_vsc">
	<session name="tcp" sharing="global">
			<protocol>net.sf.appia.protocols.tcpcomplete.TcpCompleteLayer</protocol>
	</session>
	<session name="gbl" sharing="global">
		<protocol>net.sf.appia.protocols.group.bottom.GroupBottomLayer</protocol>
	</session>
	<session name="gol" sharing="global">
		<protocol>net.sf.appia.protocols.group.heal.GossipOutLayer</protocol>
	</session>
	<session name="suspectl" sharing="global">
		<protocol>net.sf.appia.protocols.group.suspect.SuspectLayer</protocol>
	</session>
	<session name="intral" sharing="global">
		<protocol>net.sf.appia.protocols.group.intra.IntraLayer</protocol>
	</session>
	<session name="interl" sharing="global">
		<protocol>net.sf.appia.protocols.group.inter.InterLayer</protocol>
	</session>
	<session name="hl" sharing="global">
		<protocol>net.sf.appia.protocols.group.heal.HealLayer</protocol>
	</session>
	<session name="stablel" sharing="global">
		<protocol>net.sf.appia.protocols.group.stable.StableLayer</protocol>
	</session>
	<session name="ll" sharing="global">
		<protocol>net.sf.appia.protocols.group.leave.LeaveLayer</protocol>
	</session>
	<session name="vsl" sharing="global">
		<protocol>net.sf.appia.protocols.group.sync.VSyncLayer</protocol>
	</session>
	<session name="loopback" sharing="private">
		<protocol>net.sf.appia.protocols.loopBack.LoopBackLayer</protocol>
	</session>
	<session name="atsl" sharing="global">
		<protocol>net.sf.appia.jgcs.protocols.top.TOPLayer</protocol>
	</session>
</template>

<template name="tcp_total">
	<session name="tcp" sharing="global">
			<protocol>net.sf.appia.protocols.tcpcomplete.TcpCompleteLayer</protocol>
	</session>
	<session name="gbl" sharing="global">
		<protocol>net.sf.appia.protocols.group.bottom.GroupBottomLayer</protocol>
	</session>
	<session name="gol" sharing="global">
		<protocol>net.sf.appia.protocols.group.heal.GossipOutLayer</protocol>
	</session>
	<session name="suspectl" sharing="global">
		<protocol>net.sf.appia.protocols.group.suspect.SuspectLayer</protocol>
	</session>
	<session name="intral" sharing="global">
		<protocol>net.sf.appia.protocols.group.intra.IntraLayer</protocol>
	</session>
	<session name="interl" sharing="global">
		<protocol>net.sf.appia.protocols.group.inter.InterLayer</protocol>
	</session>
	<session name="hl" sharing="global">
		<protocol>net.sf.appia.protocols.group.heal.HealLayer</protocol>
	</session>
	<session name="stablel" sharing="global">
		<protocol>net.sf.appia.protocols.group.stable.StableLayer</protocol>
	</session>
	<session name="ll" sharing="global">
		<protocol>net.sf.appia.protocols.group.leave.LeaveLayer</protocol>
	</session>
	<session name="vsl" sharing="global">
		<protocol>net.sf.appia.protocols.group.sync.VSyncLayer</protocol>
	</session>
	<session name="total" sharing="private">
		<protocol>org.continuent.appia.protocols.total.sequencer.TotalSequencerLayer</protocol>
	</session>	<session name="atsl" sharing="global">
		<protocol>net.sf.appia.jgcs.protocols.top.TOPLayer</protocol>
	</session>
</template>

<channel name="vsc+fifo" template="tcp_vsc" initialized="no">
	<memorymanagement size="100000000" up_threshold="60000000" down_threshold="30000000" />
	<chsession name="atsl">
		<parameter name="gossip_address">224.1.1.7</parameter>
	</chsession>
</channel>

<channel name="vsc+total" template="tcp_total" initialized="no">
	<memorymanagement size="100000000" up_threshold="60000000" down_threshold="30000000" />
	<chsession name="atsl">
		<parameter name="gossip_address">224.1.1.7</parameter>
	</chsession>
</channel>

</appia>
