<?xml version="1.0" encoding="UTF-8"?>
<!DOCTYPE appia PUBLIC "-//DTDName//DTD//EN"
	"../xml/appiaxml.dtd">
<appia>
	<template name="ecco_t">
		<session name="tcp_s" sharing="global">
			<protocol>net.sf.appia.protocols.tcpcomplete.TcpCompleteLayer</protocol>
		</session>
		<session name="ecco_s" sharing="private">
			<protocol>net.sf.appia.test.xml.ecco.EccoLayer</protocol>
		</session>
	</template>
	<channel name="ecco_c" template="ecco_t" initialized="yes">
		<chsession name="ecco_s">
			<parameter name="localport">4000</parameter>
			<parameter name="remotehost">localhost</parameter>
			<parameter name="remoteport">4001</parameter>
		</chsession>
	</channel>
</appia>
